{
  "run_id": "run-fixture",
  "tab_id": null,
  "timestamp": "2026-05-31T12:00:00Z",
  "kind": "run-started",
  "severity": "info",
  "message": "run started",
  "fields": {
    "config": "config/jailgun.example.toml",
    "tabs": "5",
    "batch_tabs": "5",
    "loop_count": "0",
    "planned_tabs": "5"
  }
}
