{
  "run_id": "run-fixture",
  "tab_id": 1,
  "timestamp": "2026-05-31T12:10:48Z",
  "kind": "deploy-finished",
  "severity": "info",
  "message": "deploy finished",
  "fields": {
    "outcome": "succeeded",
    "local_sha256": "ff297136810aa7374c842e77f57f506dd631be7033975ce6d454bdc82086ded4",
    "remote_sha256": "ff297136810aa7374c842e77f57f506dd631be7033975ce6d454bdc82086ded4",
    "post_head": "abc1234deadbeef",
    "receipt_path": "/Users/example/artifacts/receipts/run-fixture/run-fixture-tab-01-deploy.json"
  }
}
